{
  "version": 1,
  "updatedAt": "2026-10-06",
  "status": "planning-draft",
  "tasks": [
    {
      "id": "T01",
      "familyId": "T01",
      "name": "Cadena de interior, exterior y planta",
      "category": "Control",
      "objective": "Enlazar contactos sin perder alcance y comparar ambos pies.",
      "setup": "Balón entre los pies y espacio libre a ambos lados.",
      "space": "home",
      "participants": 1,
      "equipment": [
        "balón"
      ],
      "steps": [
        "Empuja corto con el interior del pie derecho hacia la izquierda.",
        "Con el mismo pie usa el exterior para devolverlo a la derecha.",
        "Recoge con la planta, recoloca el apoyo y repite con el pie izquierdo."
      ],
      "success": "Balón al alcance del siguiente toque; no perseguirlo fuera del área.",
      "mistakes": "Golpear fuerte, dejar el peso encima del balón o añadir saltos sin control.",
      "easier": "Separar cada contacto y recolocar el balón.",
      "harder": "Encadenar sin pausa. Cambiar orden o dirección sin aumentar todo a la vez.",
      "limits": "No acredita regate ante rival; no añadir saltos por defecto.",
      "modalities": {
        "fut5": "Acercar el balón a la siguiente protección con planta.",
        "fut7": "Añadir salida hacia conducción en otra tarea de cancha.",
        "fut11": "Preparar un contacto que permita recibir o conducir, sin prometer transferencia."
      },
      "videos": [],
      "sourceRefs": [
        "C01",
        "C04",
        "C19"
      ],
      "review": "documentary-draft"
    },
    {
      "id": "T02",
      "familyId": "T02",
      "name": "Arrastre en V y salida diagonal",
      "category": "Control",
      "objective": "Reorientar balón y cuerpo hacia una salida clara.",
      "setup": "Balón delante; marca dos salidas diagonales cortas.",
      "space": "home",
      "participants": 1,
      "equipment": [
        "balón",
        "marcas planas"
      ],
      "steps": [
        "Apoya un pie en el suelo y coloca la planta del otro sobre el balón.",
        "Arrastra hacia ti; retira la planta y abre el pie.",
        "Empuja con el interior hacia la diagonal del mismo lado; cambia los apoyos para repetir."
      ],
      "success": "El balón dibuja una V con dos contactos distinguibles.",
      "mistakes": "Intentar arrastrar y empujar a la vez; perder el equilibrio sobre el balón.",
      "easier": "Aprender arrastre y salida por separado.",
      "harder": "Unir ambas fases. Elegir una de dos salidas; después llevar a cancha con rival.",
      "limits": "Adaptación propia; no copia del circuito Diamond. Cabida y apoyos pendientes de autoría; no torsión forzada sobre pie fijo.",
      "modalities": {
        "fut5": "Salida pequeña para escapar de presión cercana.",
        "fut7": "Conectar con aceleración y pase posterior fuera de casa.",
        "fut11": "Conectar con recepción y cambio de orientación según presión."
      },
      "videos": [
        {
          "id": "mastery-4",
          "videoId": "e5RxAJM-oxc",
          "channel": "7mlc",
          "title": "Recorte en V",
          "start": 207,
          "end": 242,
          "match": "demonstration",
          "note": "Observa el cambio de apoyos junto al contacto. El ritmo del video no es una dosis obligatoria."
        }
      ],
      "sourceRefs": [
        "C05",
        "C19"
      ],
      "review": "documentary-draft"
    },
    {
      "id": "T03",
      "familyId": "T03",
      "name": "Proteger, girar y conservar",
      "category": "Regate",
      "objective": "Interponer una posición útil sin perder opciones de pase o giro.",
      "setup": "Pareja en una zona amplia; presión suave al principio, sin empujones.",
      "space": "court",
      "participants": 2,
      "equipment": [
        "balón",
        "marcas"
      ],
      "steps": [
        "Recibe y coloca tu cuerpo entre rival y balón.",
        "Mantén el balón en el lado alejado, con pasos cortos para seguir la presión.",
        "Gira únicamente si aparece espacio; si no, conserva o descarga al pasador."
      ],
      "success": "Conservar una opción de pase o salida sin cargar contra el rival.",
      "mistakes": "Girar siempre hacia la presión o usar los brazos para empujar.",
      "easier": "Sin oposición; reconocer posiciones.",
      "harder": "Presión limitada. Oponente libre con opción de apoyo.",
      "limits": "Contacto reglamentario y superficie por definir; una postura estática doméstica no valida protección real.",
      "modalities": {
        "fut5": "Planta y apoyos cortos; salida o descarga del pívot.",
        "fut7": "Conservar para enlazar ida y vuelta.",
        "fut11": "Recibir de espaldas entre líneas o sostener una posesión."
      },
      "videos": [],
      "sourceRefs": [
        "C03",
        "C09"
      ],
      "review": "documentary-draft"
    },
    {
      "id": "T04",
      "familyId": "T04",
      "name": "Pase y recepción con pared",
      "category": "Recepción y pase",
      "objective": "Dosificar el pase y preparar la devolución.",
      "setup": "Pared apta o rebotador, fuera de casa; marca dos zonas laterales de recepción.",
      "space": "wall-area",
      "participants": 1,
      "equipment": [
        "balón",
        "pared apta para balón",
        "objetivo marcado"
      ],
      "steps": [
        "Pasa por el suelo hacia una zona de rebote constante.",
        "Antes del regreso, ajusta el apoyo y abre el cuerpo hacia la siguiente salida.",
        "Recibe alejando el balón del centro y devuelve con el otro pie; alterna lados."
      ],
      "success": "Primer toque útil para el pase siguiente, sin correcciones apresuradas.",
      "mistakes": "Golpear demasiado fuerte, esperar inmóvil o recibir debajo del cuerpo.",
      "easier": "Acercar un objetivo amplio y recibir antes de pasar.",
      "harder": "Modificar ángulo o velocidad. Un toque solo cuando la situación lo permite.",
      "limits": "Pared despejada para ejercicio corporal no significa apta para golpear balón; rebote conocido no sustituye compañero móvil.",
      "modalities": {
        "fut5": "Devolución corta y rápida, con planta cuando tenga sentido.",
        "fut7": "Pared seguida de desplazamiento hacia nueva línea.",
        "fut11": "Primer toque y pase con amplitud progresiva, no pase largo en habitación."
      },
      "videos": [
        {
          "id": "rebound",
          "videoId": "Bd7TH9t_djM",
          "channel": "Become Elite",
          "title": "Recepción y pase con rebotador",
          "start": 458,
          "end": 491,
          "match": "component",
          "note": "Referencia de un componente; la organización de nuestra tarea se explica debajo."
        }
      ],
      "sourceRefs": [
        "C07",
        "C19"
      ],
      "review": "documentary-draft"
    },
    {
      "id": "T05",
      "familyId": "T05",
      "name": "Recepción orientada hacia dos salidas",
      "category": "Recepción y pase",
      "objective": "Dar continuidad a la recepción hacia una opción útil.",
      "setup": "Pasador, receptor y dos puertas laterales; acordar primero dirección y velocidad.",
      "space": "court",
      "participants": 2,
      "equipment": [
        "balón",
        "dos puertas de marcas"
      ],
      "steps": [
        "Mira las puertas antes de que llegue el pase.",
        "Colócate con posibilidad de salir a ambos lados, sin perder el balón de vista al contacto.",
        "Orienta el primer toque a la puerta libre y conduce o pasa después; cambia de lado."
      ],
      "success": "La primera acción lleva hacia espacio aprovechable.",
      "mistakes": "Decidir la salida sin mirar, recibir de frente rígido o alargar demasiado el toque.",
      "easier": "Una sola salida y pase previsible.",
      "harder": "Variar llegada. Añadir oponente que cierre una salida.",
      "limits": "No imponer siempre interior, exterior, pie alejado ni giro; preservar la opción de descargar.",
      "modalities": {
        "fut5": "Poco tiempo de contacto y ángulos cercanos.",
        "fut7": "Salida a pase vertical o conducción media.",
        "fut11": "Recepción entre líneas con información de ambos lados."
      },
      "videos": [
        {
          "id": "box-first-touch",
          "videoId": "Bd7TH9t_djM",
          "channel": "Become Elite",
          "title": "Primer toque en un cuadro",
          "start": 35,
          "end": 65,
          "match": "component",
          "note": "Referencia de un componente; la organización de nuestra tarea se explica debajo."
        }
      ],
      "sourceRefs": [
        "C07",
        "C09",
        "C11"
      ],
      "review": "documentary-draft"
    },
    {
      "id": "T06",
      "familyId": "T06",
      "name": "Mirar, identificar y usar la información",
      "category": "Percepción",
      "objective": "Vincular exploración visual con una elección comprobable.",
      "setup": "Un pasador, un receptor y un apoyo que cambia de lado detrás del receptor.",
      "space": "court",
      "participants": 3,
      "equipment": [
        "balón",
        "marcas"
      ],
      "steps": [
        "El apoyo se mueve mientras el receptor prepara la recepción.",
        "El receptor mira para localizarlo antes de controlar.",
        "Recibe y pasa a su nueva posición; si la línea se cierra, conserva y vuelve a ofrecerte."
      ],
      "success": "Usar lo visto en la elección, no contar giros de cabeza.",
      "mistakes": "Mirar por obligación sin identificar nada o dejar de ver el balón al golpear.",
      "easier": "Compañeros quietos y tiempo amplio.",
      "harder": "Receptores móviles. Un defensor limita una línea durante el pase.",
      "limits": "Señales de color pueden familiarizar con atender otra información; no equivalen a leer rivales.",
      "modalities": {
        "fut5": "Detectar apoyo próximo y presión a la espalda.",